<!ELEMENT dataset (
    PERIODASSTRING2*)>

<!ELEMENT PERIODASSTRING2 EMPTY>
<!ATTLIST PERIODASSTRING2
    ID CDATA #REQUIRED
    NAME CDATA #IMPLIED
    PERIOD CDATA #IMPLIED
>

